opinionText,opinionTitle,starRating
"schlechte Erfahrung mit dem Telekom Kundenservice bei neuem Festnetz & Internet Anschluss. Der Techniker kam nicht zum vereinbarten Termin, beim neuen Termin an einem anderem Tag dann 2 Stunden vor der eigentlichen Zeitspanne. Gleichzeitig verlangt die Telekom 50 €, wenn man selbst beim Termin?! (Zeitfenster über 6 Stunden)nicht da ist – absolute Frechheit! Nach meinem Vertragsabschluss über Verivox (inkl. Cashback) wurde ich von einem Mitarbeiter angerufen, angeblich wegen einer Störung. Ein Vertragswechsel wurde nicht klar angesprochen. Nach dem Gespräch bekam ich plötzlich einen neuen Vertrag per Mail bestätigt mit anderen, teureren Konditionen und ohne Cashback, den ich so nicht abgeschlossen habe. Der Kundenservice war schwer erreichbar. Mir wurde gesagt ich hätte nun zwei gleichzeitig laufende Verträge?!?!!  Erst nach Beschwerde wurde versucht, das Ganze zu klären. Was am Ende dann auch erfolgreich war. Insgesamt wirkt das dennoch sehr intransparent und wie eine schmierige Telefon-Masche.",Vorsicht bei Telekom Anrufen!,Valorada con 1 estrellas sobre 5
"Ich bin seit vielen Jahren Telekom-Kunde und war lange zufrieden. Umso enttäuschender ist das, was ich seit Monaten erlebe. Sowohl das Mobilfunknetz als auch der Festnetzanschluss weisen seit dem Sommer 2025 massive und dauerhafte Probleme auf. Mobiles Internet ist in unserer Umgebung faktisch kaum nutzbar. LTE funktioniert teilweise gar nicht, 5G ist extrem instabil. Das betrifft nicht nur meinen Anschluss, sondern auch mehrere Partnerkarten. Trotz zahlreicher Reklamationen hat sich bis heute nichts verbessert. Auch der Festnetzanschluss ist unzuverlässig. Beim Streaming kommt es regelmäßig zu Verbindungsabbrüchen mit mehrminütigen Ausfällen. Alle Standardmaßnahmen wie Router-Neustart, Zurücksetzen oder App-Konfigurationen wurden längst durchgeführt. Das Problem besteht unverändert fort. Besonders ärgerlich ist die Kommunikation. Ich habe mehrfach telefonisch Kontakt aufgenommen, mir wurden Rückmeldungen zugesagt, die nie erfolgt sind. Stattdessen erhielt ich automatisierte Rückrufversuche, bei denen ich nach dem Abheben wieder in Warteschleifen landete. Zusätzlich bekam ich ein Antwortschreiben mit der Aufforderung, Unterlagen einzureichen, allerdings von einer doNotReply-Adresse. Das halte ich ehrlich gesagt für einen schlechten Witz. Wir leben in einer Kleinstadt mit rund 40.000 Einwohnern. Es ist schlicht nicht nachvollziehbar, dass Drittanbieter wie O2 oder Vodafone hier ein deutlich stabileres und schnelleres Netz bieten als die Telekom. Der Werbeslogan „bestes Netz“ trifft hier eindeutig nicht zu. Ich zahle monatlich über 250 Euro und erwarte dafür eine entsprechende Leistung. Diese wird seit Monaten nicht erbracht. Entsprechend habe ich eine Frist gesetzt, fordere eine Entschädigung für den Zeitraum seit Sommer 2025 und werde den Vorgang zusätzlich der Verbraucherzentrale sowie der Bundesnetzagentur melden. Nach dieser Erfahrung kann ich die Telekom aktuell leider niemandem empfehlen. Sehr schade, gerade als langjähriger Kunde.",Niemals das beste Netz!,Valorada con 1 estrellas sobre 5
"Nach Kündigung werden wir nun ständig von irgendwelchen 0800er Nummern der Telekom bzw deren Subunternehmer terrorisiert. Ich habe längst mit einem Mitarbeiter eine ""Kundenrückhol-Konversation"" geführt, die leider keinen positiven Ausgang hatte, weil die Angebote allesamt mindestens 15€ über den Angeboten der Konkurrenz lagen. Meine Zustimmung zur Kontaktaufnahme habe ich vor Wochen zurück gezogen! Der Terror geht weiter, absolute Frechheit und wirklich ätzend. ",Telefonterror nach Kündigung,Valorada con 1 estrellas sobre 5
"Große Versprechungen aber in Baden-Württemberg und Bayern hat man alle paar Kilometer Netzabbrüche! In der Schweiz und in Österreich haben wir eine schwierigere Topographie,  trotzdem ist das Netz besser! Gewinnmaximierung vor Kundenorientierung!!!",Netzabdeckung ungenügend!!!,Valorada con 2 estrellas sobre 5
Vielen Dank an die Telekom. Seit Stunden versuche ich eine störmeldung zu tätigen. Bekomme die Meldung ihre Wartezeit beträgt 60 Minuten. 🤢. Bist halt auf dem Lande nichts wert. Habe 1 Festnetzvertrag und 3 Handyverträge. Aber egal. Ich hoffe es kommt mal jemand der euch mal vom Markt verschwinden lässt. Es sitzen bestimmt eure Chefs gerade in ihren Villen und lassen es sich gut gehen. Ich habe so die schnauze voll von der Bude. Es kotz mich nur noch an. Ihr .. .. kommt mal in die Bewegung.,Vielen Dank an die Telekom,Valorada con 1 estrellas sobre 5
"Ein Haustürvertrag wurde am 11.12. erschlichen ('es wäre etwas schiefgelaufen' Benachrichtigung auf WhatsApp!), ein Widerruf sofort eingereicht. Da keine Bestätigung  durch die Telekom erfolgt war, wurde noch zweimal an die Widerrufsstelle der Telekom geschrieben, auch mit der Beschreibung des Vorgangs der 'Erschleichung' -leider keine Reaktion. Heute nun eine Email 'Ich sehe dass ein ursprünglicher Stornowunsch am 18.12.2025 rechtzeitig innerhalb der Widerrufsfrist eingegangen ist. Jedoch möchte ich aufgrund der vorliegenden Situation rückfragen: Der formale Anbieterwechsel war zum 08.01.2026 abgestimmt, somit wurde der Vertrag bei EWE TEL beendet. Es gab seitdem keine Weiterversorgung Der Anschluss von der Telekom müsste nur aktiviert werden um wieder Verbindung und Telefonie zu haben. Sollten Sie aber auf Stornierung bestehen, werden wir diese auch durchführen, können aber aufgrund des zeitlichen Ablaufs keine Wiederanschaltung bei EWE Tel erzeugen....' Darf ich zusammenfassen? Vertrag erschlichen, 3x Widerruf eingereicht (11.12., 18.12., 26.12.), am 23.12. die Nachfrage, ob denn nicht doch bei der Telekom unterschreiben würde, einstiger Anschluss ist weg. Ich sage vorsichtig, in Erinnerung an die Drückerkolonnen, das ist m.E. Betrug.",Ein Haustürvertrag wurde am 11.12,Valorada con 1 estrellas sobre 5
Katastrophe. Nach Fünf Terminen und Monaten noch kein Internet. Zwei Termine waren OK wegen der Besichtigung des Hauses bzw. der Wohnung und des Leistungsweges. Bei den zwei darauf folgenden Terminen hatte der Techniker keine Infos das er einen zweiten Kollegen benötigt um vier löcher zu Bohren damit das Glasfaserkabel verlegt werden kann. Der Fünfte Termin wurde nachmittags um 13:30 Uhr am selben Tag verschoben. Ich habe jetzt wieder einen Termin der ein ganz anderer ist wie zuvor vereinbart und per Mail bestätigt wurde(durch eine zweite Mail mit Termin-Bestätigung) Ich bin gespannt wie viele Urlaubstage ich noch Opfern muss.....,Termine für Glasfaser ,Valorada con 1 estrellas sobre 5
"Als jemand der deutliche Worte findet wenn etwas nicht funktioniert hier ein Wort des Lobes: Meine FritzBox7590 ist nach 7 Jahren Betrieb abgebrannt - ja , buchstäblich. Ich habe mir also eine 7690 gekauft und mich schon bereit gemacht in die Papiere der Telekom abzutauchen, habe dafür mehrere Stunden Ärger eingeplant. Doch dieses Easy Support hat die Box komplett alleine mit dem Internet verbunden. Muss wohl was mit dem Hausanschluss zu tun haben. Daher - Gut gemacht Telekom. Jetzt verbessert noch euer Peering und es wird Lob regnen.",Als jemand der deutliche Worte findet…,Valorada con 5 estrellas sobre 5
"Ich bin noch Kunde von Magenta TV. Kein anderes Unternehmen gibt mir das Gefühl, dass ich als Kunde einfach verachtet werde. Ein Beispiel ist der unsägliche Umgang mit der Installtion neuer Plattformen, die regelmäßig den Austausch des Mediaservers erfordern. Lösungen, um ggf. seltene Aufnahmen zu sichern, bietet die Telekom nicht an. Die Interessen der Kunden sind irrelevant für die Telekom.  Statt dessen wird eine Info hingerotzt....friss oder stirb.",Ich bin noch Kunde von Magenta TV.,Valorada con 1 estrellas sobre 5
Schade dass man keine Minuspunkte vergeben kann. Zweimal über das Formular auf der Interntseite den Einzelverbindungsnachweis angefordert. Jedesmal die Info kommt in den nächsten Tagen. Nach drei Wochen angerufen.  Nach einer weiteren Woche wieder angerufene Wieder eine Woche ist vergangen. Es passiert einfach NIX. Seid Ihr nicht in der Lage einen Einzelverbindungsnachweis rückwirkend zu generieren??? So unfähig Wie oft soll ich noch anrufen? Macht was für Euer Geld,Schade dass man keine Minuspunkte…,Valorada con 1 estrellas sobre 5
"Es ist unrechtmäßig das man diese Funktion in den genannten Wegen nicht deaktivieren kann.!! . Um dem InfoService der Telekom zu widersprechen, können Sie den Service direkt im Kundencenter unter telekom.de infoservice ändern, eine E-Mail an widerruf(at)telekom.de senden, das Datenschutz-Kontaktformular nutzen oder schriftlich an die Telekom Deutschland GmbH Landgrabenweg 149, 53227 Bonn senden, um Werbeangebote und Informationen zu widerrufen. Das dumme ist aber das man ungefragt diesen sogenannten Service einfach aufgedrückt bekommt und auf den genannten wegen nicht abbestellen kann.  Ein Datenschutz-Kontaktformular gibt es nicht. Auch eine Email verläuft irgendwo im Nirwana. Servicewüste Deutschland läßt grüßen. Ein Anruf bei dem sogenannten Kundeservice wurde eine halbe Stunde immer wieder weitergeleitet und immer wieder in die Warteschleife und einfach aufgelegt. Das ist die Service-Wüste Deutschland, und allen voran ""Telekom und Co.""",Service unter 0,Valorada con 1 estrellas sobre 5
"Falsche Versprechen beim Glasfaser-Ausbau, die an arglistige Täuschung grenzt. Versprochenen Glasfaser-Anschluss spätestens 3 Monate nach Vertragsabschluss, bei Umstellung zum Übergangstarif vom Techniker gesagt bekommen, dass das wahrscheinlich noch ein Jahr dauern kann. Preise sind einfach nur teuer und nicht kompetitiv. 100 MBit/s DSL für 50€ im Monat, wenn ich einen Kabelanschluss mit 500 Mbit/s für den gleichen Preis haben kann? Danke, nein Danke. Die Servicemitarbeiter versuchen ihr bestes, um die Frustration der Kunden zu verstehen und deren Anliegen zu bearbeiten. Das Telekom-Geschäftsmodell besteht nur auf ""Bruder, vertrau mir. Wir sind die Besten auf dem Markt"", aber die Preise sind zu hoch, die Konditionen zu schlecht und interne Serviceprozesse unterirdisch.",Arglistige Täuschung und schlechte Konditionen,Valorada con 1 estrellas sobre 5
"Leider wird der Kundenservice der Telekom immer schlechter. Abzocke! Man schliesst einen Vertrag mit Telefon,Internet und Tv ab. TV Box funktioniert nur nach etwa 1 Jahr nicht mehr. Ständige Reklamation bei der Telekom. Nichts passiert, dann plötzlich, mal ein kompetenter Mitarbeiter, erstattet Beträge zurück und sagt er meldet sich in 6 Monaten. Tja, als ich kündigen wollte, habe ich erfahren, dass der Vertrag für 2 Jahre verlängert wurde. Telekom lässt mich nicht raus. Jetzt soll ich weitere 2 Jahre einen Vertrag mit TV Box bezahlen, die nicht funktioniert und mittlerweile auch nicht mehr genutzt wird, da ja eine alternative gesucht wurde. Mitarbeiter hat sich auch nicht gemeldet. Seit über 1 Jahr bin ich ständig am kontaktieren der Telekom,passiert etwas, Nein. Die bleiben bei ihrer Meinung. Vertrag muss 2 weitere Jahre gezahlt werden,für etwas das nicht funktioniert",Abzocke,Valorada con 1 estrellas sobre 5
Eines der größten Telekommunikationsunternehmen-nur du bekommst niemand ans Telefon !! Vertrag abgeschloosen ist schnell-nur der Service danach .....,Telekom und ihre Hotline,Valorada con 1 estrellas sobre 5
"Seit meiner Kündigung werde ich fast jeden Tag vom Kundendienst angerufen und das immer wieder von unterschiedlichen Mitarbeitern. Ein gutes CRM System scheint die Telekom nicht zu haben. Bei all den Telefonaten war schon alles dabei von ""wir können Ihnen leider kein Angebot schicken. Sie müssen erst abschließen danach schicken wir Ihnen ein Angebot"" bis zu meinem heutigen Telefonat, bei dem ich dem Kundendienst gesagt habe, ich möchte mir das Angebot (welches ich doch dann tatsächlich vorab per Mail heute bekommen habe) in Ruhe anschauen. Der Mitarbeiter hat nicht locker gelassenund wollte unbedingt, dass ich sofort in meine Mails schaue, um mit ihm über das Angebot zu sprechen. Ich informierte ihn, dass ich mir es in anschaue und wir gerne dazu am Folgetag telefonieren können. Daraufhin kam dann die Kleine, versuchte Erpressung. Wenn wir erst morgen über das Angebot sprechen, würde er erst morgen entscheiden, ob das Angebot noch Gültigkeit hat und er mir den jetzt gerade gewährten Rabatt noch gewährt oder nicht. Des Weiteren wurde ich fast immer unterbrochen, mir war es nicht möglich, meine Sätze auszusprechen, bis ich ihn darauf hingewiesen habe. Er solle mich bitte aussprechen lassen. Das hat ihm scheinbar nicht gefallen, und er hat mit einem Gespräch aufgelegt. Ein Hoch auf den Kunden ein Glück habe ich das Angebot vorab mit seinem Namen per Mail erhalten. Liebe Telekom, falls es euch interessiert, welche Mitarbeiter bei euch die Kunden werben sollen, könnt ihr euch gerne an mich wenden..",versuchte Erpressung vom Kundendienst,Valorada con 1 estrellas sobre 5
"ich habe heute den gesamten Tag auf einen Telekom Techniker gewartet mit dem ein Termin zwischen 10:00 Uhr  und 14 Uhr ausgemacht war. Es würde mir weder telefonisch  abgesagt oder mitgeteilt das eine Verspätung einzuplanen ist. Mein Glasfaser Vertrag ist zwar mit 1&1 das rechtfertigt aber nicht, dass ausgemachte Termine nicht eingehalten werden! Ich kann es mir in meinem Job nicht leisten so zu arbeiten, vielleicht sollte ich zur Telekom wechseln, scheint ein ziemlich lässiges Leben zu sein.",Termine werden nicht eingehalten ,Valorada con 1 estrellas sobre 5
"Für über 50 Euro im Monat, erwarte ich, dass das Internet reibungslos läuft. Seit mehreren Wochen gibt es wiedermal täglich (und mehrmals am Tag) Ausfälle und das Internet ist langsam. Wenn die eigenen mobilen Daten (bei O2) zuverlässiger und schneller sind, selbst wenn das Volumen aufgebraucht ist und eingeschränkt funktioniert, ist das eigentlich ein Zeichen, von der Telekom zu einem anderen Anbieter zu wechseln.",Mobil Daten zuverlässiger als Telekom ,Valorada con 2 estrellas sobre 5
"Da ich berufstätig war, habe ich Xplora x6play am 12. Januar 2026 über die Webseite des Telekommunikationsanbieters gekauft. Um die Smartwatch zu nutzen, müssen Sie sie mit der Xplora-App verbinden. Dazu muss Bluetooth auf der Smartwatch aktiviert sein.Die Bluetooth-Funktion der ersten Uhr, die ich gekauft habe, ließ sich nicht einschalten. Sie wurde gegen eine neue ausgetauscht, aber bei der neuen Uhr trat dasselbe Problem auf.Der Kundenservice konnte das Problem nicht lösen. Deshalb habe ich den Vertrag gekündigt. Weil ich dumm bin, dieses Mal ging ich zur Telekommunikationsfiliale. Ich kaufte mir ein weiteres, genau gleiches Gerät. Und was soll ich sagen? Auch dieses hat dasselbe Problem. Ich glaube, ich bin ein unverbesserlicher Mensch. Telekom und Xplora sind eine Quelle des Ärgers. Ich ärgere mich schon seit zwei Wochen über diesen sinnlosen Kram.Er hat mich offiziell mit der Qualitätskontrolle der Produkte des Herstellers und der Telekommunikationsanbieter betraut.",Deutsche Telekom und Xplora (x6play) sind ein Grund zum Bedauern.,Valorada con 1 estrellas sobre 5
"Extrem nervige und aufdringliche Promoter unterwegs. Bei mir in der Nachbarschaft klingeln in regelmäßigen Abständen immer mal wieder Telekom Promoter (oder wie auch immer die heißen). Diese meist männlichen Mitarbeiter sind sehr aufdringlich und wollen einem Glasfaseranschlüsse verkaufen. Bei meiner Nachbarin war sogar einer in der Wohnung und sie musste Hilfe holen, damit dieser aus der Wohnung wieder verschwindet. Wir haben im Haus dann diesen Mitarbeitern Hausverbot erteilt - die Telekom schickt aber anscheinend immer wieder neue Leute. Weil ich abgelehnt habe und meiner Nachbarin empfohlen habe dies ebenfalls zutun, hat der Promoter dann bei mir ca. 5min Dauer-geklingelt und war sichtbar wütend. Keiner im Haus möchte Glasfaser haben, da dieser für die selbe Schnelligkeit (z.B. 50.000er Leitung) viel teurer ist. Ich empfehle der Telekom dringend die Preise gleichzuschalten, sonst wird der große Erfolg mit dieser alten Technologie die als neu verkauft wird scheitern. Ebenfalls sollte sich die Telekom schämen für solche Mitarbeiter. Meiner Meinung nach kann ich diesen aufdringlichen und schon fast angsteinflößenden Konzern nicht empfehlen. Wer so mit potenziellen Kund*innen umgeht, der wird diese wohl eher nicht anwerben können.",Extrem aufdringliche Promoter,Valorada con 1 estrellas sobre 5
Am liebsten kein stern internet fällt ständig aus kan kein Fußball spiel gucken angeblicht 100 mbit/s . Nicht weiter empfelehnswert.,Unzuverlässig ,Valorada con 1 estrellas sobre 5
"Die Telekom hat meinen Vertrag einen Tag vor dem geplanten Technikertermin ohne mein Einverständnis storniert. Eine Wiederherstellung des Vertrags wurde mir mitgeteilt als nicht möglich, obwohl die Stornierung einseitig durch die Telekom erfolgte. Als Ausgleich wurden mir ausschließlich schlechtere Ersatzangebote unterbreitet, jedoch keine gleichwertige Gegenleistung. Dieses Vorgehen ist für mich inakzeptabel. Zudem zeigt die Telekom keinerlei Bereitschaft, mir in dieser Situation angemessen entgegenzukommen.",Unberechtigte Stornierung meines Telekom-Vertrags kurz vor Technikertermin,Valorada con 1 estrellas sobre 5
"unfähige Hotline, Keine Abstimmung mit Techniker, Immer anderen Mitarbeiter am Telefon mit völlig gegensätzlichen Aussagen",unfähige Hotline,Valorada con 1 estrellas sobre 5
Unmöglich kurzfristig einen Ansprechpartner zufinden alles nur über KI nix geht schnell tausend mal anmelden alles total bescheuert nichts geht schnell habe es immer noch nicht geschafft eine Rechnung auszudrucken.,Unmöglich kurzfristig einen…,Valorada con 1 estrellas sobre 5
"Ich bin seit 1999 Kundin, seit 2009 habe ich Entertain. Nur gute und sehr gute Erfahrungen bei uns! Ich kann mich über nichts und niemanden beschweren. Immer wurde mir direkt und engagiert geholfen. Häufig gratis ein Techniker zu uns geschickt, der das Problem oder den Fehler auch immer fand und behob. Besonders gut finde ich die Helping-Hotline bei PC-Problemen, ich habe S und darf ein mal im Monat für 30 Minuten einen IT-Fachmann auf meinen Rechner zugreifen lassen für nur etwa 6,00 Euro brutto! Wenn man bedenkt, was man bezahlen müsste, käme jemand von vor Ort, ist das wirklich super. Ich kann die schlechten Noten nicht nachvollziehen. Von mir eine glatte Note Eins!",Ich bin seit 1999 Kundin,Valorada con 5 estrellas sobre 5
"Ist ein unbedingt mal wird beim Kundenservice am Telefon weggedrückt oder in endlos Warteschleifen gesteckt nachdem man schon Stunden gewartet hat, und dann beschwert sich der Kundenservice auch noch dass man einen anderen n Umgangston an den Tag legen soll, fu Magenta fu hilflose Telekom-Mitarbeiter",Ist ein unbedingt mal wird beim…,Valorada con 1 estrellas sobre 5
"Ein Stern ist noch zuviel für solch ein Chaos bei der Telekom, man erhält Rufnummern genannt, die nicht zum Problem passen, nach viermaligen Versuchen mit unprofessionellen Auskünften vom Kundenservice, habe ich es aufgegeben, einen Fehler der Telekom zu korrigieren. Die Telekom ist ein echtes Abbild der verlotterten Zustände überall in der Verwaltung Deutschlands.",Ein Stern ist noch zuviel für solch ein…,Valorada con 1 estrellas sobre 5
"Ich habe letzte Woche bei der Telekom ein iPhone 17 pro max im Rahmen einer Vertragsverlängerung bestellt. HEUTE habe ich bei der ""Service Hotline"" angerufen und angefragt, wann denn das Handy geliefert wird. Auskunft: Apple sei im Lieferrückstand und man erwarte das Handy in einer Woche bei Telekom! Auf meine Frage, ob ich mir das Handy bei Verfügbarkeit in einem Telekomshop holen könnte, wurde mir gesagt, das ich mich darum selbst kümmern solle!!! Ich hatte dann in Alzey und in Mainz angerufen, wo nur der AB dran ging.  Dort schilderte ich mein Anliegen und bat um Rückruf. Resultat: K E I N E S!!! Nach Jahrzehnten bei Telekom erwäge ich nun ernsthaft einen Wechsel zu einem anderen Provider.",Service UNTERIRDISCH,Valorada con 1 estrellas sobre 5
Deutsche Telekom Tiefbau GmbH hat nicht mal eine Adresse für Beschwerden,Deutsche Telekom Tiefbau GmbH hat nicht…,Valorada con 1 estrellas sobre 5
"Nach genervten 4 Stunden mit dem Versuch in einem Sterbefall den Anschluß auf die Ehefrau umzutragen, mehrere Telefonate mit der Hotline, und vor allem den Chat-BOT (der nix versteht und Fragen zu bereits abgegebnen Antworten stellt, Man sich quasi im Kreis dreht...), hat man dann doch evtl. das richtige Formular. AAAABBBEEER dann wird eine Emailadresse als Pflichtangabe  verlangt, obwohl es auch Menschen geben soll die gar kein Internet und schon garkeine Emailadresse haben, und schon wieder hängt man da blöd rum. Denn gibt man irgendetwas ein wird man nie erfahren ob der Antrag dann durchging oder irgend etwas anderes nicht passt.  Aber was solls, die Telekom hat sich in ihrem alten staatlichen Dokumentendschungel halt eingenisstet und kennt den Begriff des Bürokratieabbaus nicht. Könnte man diese ""tollen"" Onlineformulare downloaden, hätte wenigsten s die Briefpost noch etwas davon :-) Diesen ganzen M für eigentlich nur 5min Aufwand....morgen gehts weiter, mal sehen was für Vorschläge dann kommen.",Nach genervten 4 Stunden mit dem…,Valorada con 1 estrellas sobre 5
"Altgeräte werden weiter berechnet, obwohl diese entsorgt werden konnten (klare Aussage des Technikers bei Umstellung auf Glasfaser). Kontakt nur mit Automaten. Kunde wird einfach geduzt. ",Altgeräte werden weiter berechnet,Valorada con 1 estrellas sobre 5
Nie wieder Telekom Kunden Beratung ist das schlimmste was es gibt es hat mein Enkel Wow und Dazn freigeschaltet als ich das mit bekommen habe haben sie mir das von meinem Konto abgebucht obwohl ich es noch nie in Anspruch genommen habe und ich es der Kunden Beratung geschildert das es mein Enkel mit zehn Jahren ungewollt freigeschaltet hat und hier mit nicht Mal haftbar ist wird es weiterhin abgebucht jetzt habe ich als langjähriger Kunde alles gekündigt kann nur sagen reine Abzocke ich kann nur sagen Finger weg von der Telekom ,Nie wieder Telekom Kunden Beratung ist…,Valorada con 1 estrellas sobre 5
,Schlechte App,Valorada con 1 estrellas sobre 5
,Die kriegen nix auf die Reihe,Valorada con 1 estrellas sobre 5
"Auftrag eines Mobilfunkneuvertrags wird nach wie vor als genehmigt angezeigt seit Tagen, auch das Geld ist bereits abgebucht worden. Nach Rückfrage erhalte ich die Antwort dass alles storniert ist. Unfassbar sowas, Hauptsache die buchen das Geld vom Konto ab trotz stornierten Auftrag. Eine absolute Sauerei, mehr gibts dazu nicht mehr zu sagen! ",Auftrag eines Mobilfunkneuvertrags wird…,Valorada con 1 estrellas sobre 5
arbeiten mit vertrieblern zusammen die leute versuchen abzuzocken mit lügengeschichten (ranger marketing),ranger marketing abzocke,Valorada con 1 estrellas sobre 5
"Magenta TV lässt sich nach einem Todesfall nicht kündigen. Wenn man das System bei MagentaTV durchsucht, landet man immer auf dem Kündigungs- Formular für Festnetzanschlüsse. Ein Zweiter weg empfiehlt: Sie können die Kündigung wie folgt durchführen: Kundencenter › Verträge › ....   Aber den Button ""Verträge"" finde ich auch nach längerer Suche auf der Seite des Kundencenter  nicht.   Den Unsinn hat sich vermutlich mal ein Praktikant ausgedacht, und von den verantwortlichen hat das nie jemand geprüft",Abbofalle bei Toten Familienmitgliedern,Valorada con 1 estrellas sobre 5
"Titel: Nach 12 Jahren Treue: Telekom zockt Rentnerin mit wenig Geld ab! Bewertung: Es ist eine Schande! Meine Mutter ist seit 12 Jahren loyale Kundin und als Rentnerin mit wenig Geld auf jeden Euro angewiesen. Dass die Telekom ausgerechnet sie so massiv über den Tisch zieht, ist fassungslos. Sie zahlt monatlich 63,33 € für 100 Mbit/s – ein Vermögen für eine Rentnerin! Trotzdem kommen oft nur 50 Mbit/s an, nach dem Techniker waren es mickrige 79 Mbit/s. Man hat ihr ein teureres Upgrade aufgedrängt, das keine Verbesserung brachte, außer einer höheren Rechnung. Das Schlimmste: Ihre zwei mühsam ersparten TV-Boxen (Kaufpreis 241,58 €) Gesamtwert von 483,16€ wurden von der Telekom per Software einfach abgeschaltet. Man hat ihr Eigentum wertlos gemacht, nur um ihr eine zusätzliche Miete für neue Hardware aufzuzwingen. Das ist in meinen Augen Diebstahl am Kunden! Insgesamt haben wir über 210 € für Router ausgegeben, die nichts gebracht haben. Wir fordern die sofortige Kündigung und die Rückerstattung von 1.273,13 €. Das Lastschriftmandat ist entzogen. Dass ein Weltkonzern wie die Telekom eine Rentnerin so ausnimmt und ihr Eigentum zerstört, ist das Letzte. Der Fall wird der Bundesnetzagentur und der Presse gemeldet!",Nach 12 Jahren Treue: Telekom zockt Rentnerin ab und schaltet ihr Privateigentum aus,Valorada con 1 estrellas sobre 5
