opinionText,opinionTitle,starRating
"Ist das denn nicht schon Diskriminierung? Da wird im Internet angekündigt, daß für Bestands- kunden (bei uns über 4 Jahrzehnte) die Preise für DSL zum 1.4.26 erhöht werden sollen.  Parallel läuft jeden Tag teuerste Werbung in allen Medien mit lukrativen Sonderangeboten. Also subventioniert man Rabatte mit teuren Altverträgen.  Ich kann viele Meinungen zur Telekom verstehen.",Ist es schon Diskriminierung von Bestandskunden?,Valorada con 1 estrellas sobre 5
"Am 19. Januar habe ich den unglücklichen Vertrag für einen Heim-Internetanschluss unterschrieben. Am 23. Januar war der erste Termin für die Installation der Geräte, am 30. Januar der zweite Termin und am 6. Februar der dritte Termin. Der Techniker ist jedoch zu keinem dieser Termine erschienen. Heute, am 17. Februar, habe ich immer noch kein Internet. Im Shop weigert man sich, den Vertrag zu kündigen. Ich bitte Sie, den Vertrag zu kündigen und mir die Bestätigung per E-Mail zuzusenden. Waiblingen, 71334","Erfolgloser Versuch, einen Heim-Internetanschluss einzurichten.",Valorada con 1 estrellas sobre 5
"Von Telekom auf andere Anbieter gewechselt,( Vertrag gekündigt ). Trotzdem viele Monate wegen dem alten (Telekom) Router gezahlt ohne Vertrag. Beim Telefonat mit Telekom wurde mir gesagt , Router wird aus dem System genommen und es kommen keine weiteren Kosten auf mich zu . Den alten Telekom Router soll ich entsorgen. Warum wird es nicht gleich aus dem System genommen nach Vertragsende.",Kein Vertrag Trotzdem für den alten Router weitergezahlt der entsorgt werden soll,Valorada con 1 estrellas sobre 5
"Vertreter der Telekom klingeln im ganzen Haus Sturm. So lange, bis endlich jemand öffnet. Sie schaffen sich Zutritt ins Haus auf absolut respektlose Weise! ",Vertreter Telekom verschafft sich Zutritt der Telekom klingeln im…,Valorada con 1 estrellas sobre 5
"Schrecklich,abzocker,schleichte Kunden Berater,schleichte Internet,alles was ihr denkt damit ihr zufrieden wird ist falsch,einfach suchen Sie lieber andere Anbieter ","Schrecklich,abzocker,schleichte Kunden…",Valorada con 1 estrellas sobre 5
"Bei meinem Magenta Tarif funktionierte von einem Tag auf den anderen Live TV nicht mehr. Die I-Net Leitung ist einwandfrei, aber der Telekom Receiver meldet Paketverluste. Jetzt kommen die Telefonate mit der Telekom. Vor ein paar Jahren waren solche Anrufe bis auf die Wartezeit noch top. Jetzt eine Katastrophe. Erst eine KI, die nix kapiert, dann stundenlanges warten und dann Callcenter Agents, die nichts verstehen, nur noch vorgegebene Antworten geben und keinerlei Ahnung von dem haben, über was sie eigentlich reden. Mir wurde erzählt, dass die Telekom dwn Anschluss auf Gen. 2 umstellt und ich jetzt einfach Mal einen 10 eue teureren Tarif bräuchte. Also stellt die Telekom einfach Mal anschlüsse um, ohne ihre Kunden zu informieren und zwingt diese somit zu teureren Tarifen, damit sie die gleiche Leistung weiter erhalten können. Bestandskunden, welcher seit Jahrzehnten bei der Telekom sind bekommen natürlich nicht ein kleines goodie ....das bekommen nur Neukunden, ist ja klar. Hoffentlich fällt dem betrügerischen Drecksladen bald so ein Getue auf die füsse. Es wird Zeit dass hier vernünftige private alternativen auf den Markt kommen, damit die von ihrer Monopolstellung weg kommen. Wer in wie r Gegend lebt, wo es Alternativen gibt: Glückwunsch. nutzt bitte alles, nur nicht die Telekom. Diesen Rat kann ich nur jedem geben. ","Telekom - ein Monopolist,der seine Kunden mit Füssen tritt",Valorada con 1 estrellas sobre 5
Dieses Unternehmen ist die Definition von Bodenlos oder alternativ „Kundenfeindlichkeit“. Keine Möglichkeit normal in absolut kritischen Fällen mit dem Unternehmen in Kontakt zu treten. ,Dieses Unternehmen ist die Definition…,Valorada con 1 estrellas sobre 5
"Guten Tag.  Ich schreibe normalerweise nur Rezensionen, wenn ich zufrieden bin.  Jetzt ist die Enttäuschung zu groß und der Frust muss raus.  Telekom wirbt mit Glasfaser und reibungslosem Einbau.  Eine einzige Katastrophe: Sechs Tage Urlaub für Nichts. Termine wurden nicht eingehalten oder die Mitarbeiter der Firma Euronet - mit der die Telekom den Glasfaser Ausbau vornimmt - konnten die Arbeiten nicht ausführen.  Warum sie es nicht konnten, erschließt sich mir nicht. Wahrscheinlich liegt es daran, dass sie 80cm graben müßten, um unter meiner Betonplatte in den Keller zu kommen. Das wurde aber vorher abgeklärt und wäre angeblich kein Problem. Die Firma Euronet ist telefonisch sehr schwer zu erreichen. Läuft es dann über die Telekom, erreicht die die Mitarbeiter von Euronet auch nicht.  Wochen später werde ich wieder benachrichtigt wegen eines neuen Termines und es wird mir versicher, dass die erforderlichen Arbeiten diesmal durchführt werden können.  So geht das seit 7 Monaten. Zudem zahle ich monatlich 16€ mehr als bei 1&1 für einen gleichwertigen Vertrag Einzig die Mitarbeiter/innen am Telefon der Telekom sind immer freundlich und hilfsbereit.",Guten Tag,Valorada con 1 estrellas sobre 5
"Seit einiger Zeit habe ich täglich mehrere Verbindungsabbrüche. Mindestens drei Mal am Tag werde ich komplett vom Internet getrennt. Zusätzlich funktioniert die Verbindung oft nur etwa einen halben Tag stabil, danach ist das Internet entweder sehr langsam oder gar nicht nutzbar.",Seit einiger Zeit habe ich täglich…,Valorada con 1 estrellas sobre 5
"Mail an Telekom-Kundenfeedback, am 06.02.2026: Habe Mitte April 2024 (!) unter AN 801007903, (in Telekom-Email vom 17.06.2024 lautet die AN: 91110605470), Kd.Nr. 2749163765, mit einem Herrn T. Winkler hier zuhause einen Vertrag für MagentaZuhause L - MagentaTV Smart 2.0 abgeschlossen. In einer von 23 (!) Emails, die ich seither von der Telekom bekam hieß es: Glasfasertarif inkl. Hardware wird voraussichtlich bis 30.04.2025 bereitgestellt.  ... Zwar ist im vergangenen Jahr von einem der Sub-Sub-Subunternehmer im Keller meines Hauses erst eine falsche (für 8 Wohnungen), dann Wochen später die richtige (für drei Wohnungen) Glasfaserdose (Hausanschluss) angebracht worden. Das war's dann. Ich habe versucht, von den rumänischen, kirgisischen und philippinischen Arbeitern zu erfahren, wann es weitergeht, aber nix Deutsch. Die Übersetzungs-App half uns auch nicht weiter.        Am Rande: Die Leute sahen arm, übermüdet, gestresst und abgerissen aus. Der Minibager, mit dem der Kabelgraben durch den Gehweg und zum Haus gezogen wurde, hatte Löcher in den Gummi-Raupenketten, die Faserarmierung hing in Fetzen herum und sämtliche Maschinen hinterließen große Öl- und Dieselflecken. Passt nicht recht zum großspurigen Auftreten der Telekom in der TV-Werbung und den Shops.  Nach Email-Anfrage bei Telekom letztes Jahr habe ich zweimal Termine für die Fertigstellung (Anschlussdose, Modem, Router-Montage) genannt bekommen. Nun haben wir den 15.02.2026 und im Gegensatz zu meinen Nachbarn rechts und links habe ich immer noch kein Glasfaser-Internet. Am 26.02.2026 wird mein aktueller Vodafone Kabelanschluss abgeschaltet. Auf mein o.a. Telekom-Kundenfeedback kam eine Telekom-Reaktion per Messenger: Wir kümmern uns um Ihren Auftrag. Und 2. Nachricht: Ihre Bestellung ist bald bei Ihnen.   Mit Hinweis: Antwort an diesen Kurzcode nicht möglich.  (!!!) Vorgestern kam ein Paket mit einem MagentaTV One Kästchen. Soll ich nun im Wohnzimmer ein Loch in die Wand bohren und den Stecker da rein stecken, oder was?   Nach rund 22 Monaten habe ich immer noch keinen funktionierenden GF-Anschluss, die Nachbarn rechts und links schon.  Einen Glasfaser-Haus- oder Wohnungsanschluss  und ein Glasfasermodem gibt es so wenig wie Kontakt mit einem Deutsch oder Englisch sprechenden Techniker, der mir das Chaos erläutern und für Abhilfe sorgen könnte.   Unglaublich! Werde den Kabelanbieter wechseln. P. Neu",Telekom - Kundenkontaktscheuer Ausbeuter?,Valorada con 1 estrellas sobre 5
"Also mal ehrlich, habe echt den Verdacht dass hier die Deutsche Telekom abgeschirmt wird. Frage mich bei so massiven, negativen Bewertungen warum die Staatsanwaltschaft nichts macht? Es ist doch so offensichtlich dass dies Mega faul ist.  Sogar der Verbraucherschutz mit Anhang reagiert nicht. Warum ist der denn da? Ich habe den Verdacht und bin der Überzeugung dass da Beihilfe geleistet wird von wem auch immer.  Einige Anwälte scheinen auch eine sonderbare Einstellung zu haben, Zitate: Das macht ihnen nichts aus, betrachten sie es als Spende. / Wer das meiste Geld hat gewinnt. / Hat eh keinen Sinn, bekomme sowieso keine Antwort. Zitat Ende. Da ist es nur so dass man da auch alleine ist und somit nichts beweisen könnte.  Wurde vor vielen Jahren mal gefragt ob ich den Unterschied zwischen Kommunisten und Kapitalisten kenne, sagte Nein. Nun, antwortete er mir: es gibt keinen. Bei den Kommunisten wirst du eingesperrt wenn du dich wehrst, bei den Kapitalisten wirst du finanziell ruiniert. Das Resultat ist das selbe. ",Also mal ehrlich,Valorada con 1 estrellas sobre 5
"Also, 40 Euro im Monat für insgesamt 4 Stunden wirklich vernünftig nutzbares Internet ist krass schlecht. Aber typisch deutsch. Überall wurde gespart und die alten, fetten Schinken haben sich nur das Geld aufs Konto geschaufelt. Peinlich sowas. Braucht man sich gar nicht wundern, warum es gar kein richtig gutes deutsches e-sport-team gibt, wenn man so ne ranzige Hütte namens Telekom in DE hat. Empfehlung von mir, nimmt lokale Anbieter, die sich um ihre Kunden bemühen und nicht nur Jitter, Packet loss, Input Lag und Bufferbloat für einen übermäßig hohen Preis anbieten. ","Unglaublich schlechtes, aber typisch deutsches Unternehmen",Valorada con 1 estrellas sobre 5
"### ⭐☆☆☆☆ – Große Enttäuschung statt Fortschritt Es ist wirklich sehr schade, dass man sich als Kunde offenbar nur so lange wertgeschätzt fühlt, bis der Vertrag unterschrieben ist. Danach scheint Betreuung oder Verbindlichkeit keine große Rolle mehr zu spielen. Vor fast **einem Jahr ** 21.03.2025 habe ich voller Hoffnung einen Glasfaseranschluss bestellt – in der Erwartung, endlich eine stabile und zeitgemäße Internetverbindung zu bekommen. Stattdessen sitze ich bis heute weiterhin auf gerade einmal **16 MBit** fest. Für das Jahr 2026 ist das schlichtweg enttäuschend. Bei Nachfragen direkt bei der Telekom wird man an den Ausbaupartner verwiesen. Dort passiert allerdings ebenso wenig. Man fühlt sich von einer Stelle zur nächsten geschoben, ohne konkrete Aussagen, ohne transparente Informationen und vor allem ohne sichtbaren Fortschritt. Selten bereue ich eine Entscheidung – doch diese hier bereue ich sehr.   Die Vorfreude auf schnelles Internet ist längst Frustration gewichen. So stellt man sich Service und Kundenorientierung definitiv nicht vor.",Enttäuschung statt Fortschritt,Valorada con 1 estrellas sobre 5
Ich habe Prepaid Tarif bei Telekom gekauft. Alles war schnell abgelaufen und ich bekam sogar ein Handy dazu für 3€.Ich kann fast überall ohne Unterbrechung surfen mit 5G. Kundenservice sehr freundlich und hilfsbereit. Es kostet 100€ pro Jahr für 30GB pro Monat und man kann sogar die verbliebene Datenvolume sogar in nächste Monat mitbringen!Jetzt surfe ich echt im Besten Netz!🔥,Im besten Netz!🔥,Valorada con 5 estrellas sobre 5
"Ich wünschte, ich hätte die Bewertungen gecheckt bevor ich einen 2-Jahres Internetvertrag unterschrieben habe. Ab diesem Juni bin ich endlich frei! Das langsamste Internet über die Telefonbox welches ich je hatte, und das im Jahre 2024-26. Kundenservice zwar freundlich aber komplett nutzlos, weil es nur die Option gibt zusätzliche Router/Verstärker zu kaufen, sodass ich irgendwann statt bei 45 EUR/Monat bei fast 70 EUR gewesen wäre. Zusätzlich hat mir der Kundenservice nur dann tatsächlich versucht zu helfen, nachdem ich mich auf social media öffentlich in meinen Stories beschwert habe, worauf dann eine DM kam. Alles in Allem super unzufriedenstellend, und ich rate jedem davon ab!","Alles in Allem super unzufriedenstellend, und ich rate jedem davon ab!",Valorada con 1 estrellas sobre 5
"Wenn Mitarbeiter ins Telefon ""yalla"" brüllen, weiß man, man ist bei der Telekom. Lassen einen nicht ausreden, sind aggressiv, können schlecht deutsch verstehen.  Was ist aus der telekom geworden?? Was sind das für Menschen, die dort angestellt werden? Frech, aggressiv, versuchen es nicht mal, die simpelsten Dinge zu verstehen. Aufgrund der schlechten deutschkenntnisse, konnte mein Problem nicht gelöst werden.  Es ist zum heulen. Was ist aus unserem Land geworden?  P.s: am Ende wollte man mir einen neuen Vertrag andrehen, hat mich nicht zu Wort kommen lassen. Hat aggressiv und vorwurfsvoll gefragt ""was denn da passiert sein soll"" , weshalb ich den Vertrag kündige..  Der Kundenservice war schon immer unfreundlich, aber DAS hat alles übertroffen.  Wir sind hier bei einem (eigentlich) seriösen Anbieter, was sollen dann solche unter Druck setzenden Praktiken? Fast schon wie in einem schneeballsystem. Man kann ja nach dem Grund fragen, aber so aggressiv und Manipulativ?  Bin echt froh gekündigt zu haben. So ein Unternehmen darf nicht unterstützt werden. Bei der Konkurrenz läuft die Kommunikation viel einfacher, freundlicher und zugänglicher. Mein hartverdientes Geld fließt ganz bestimmt nicht in eure Taschen.  Euer social Media Auftritt ist rausgeputzt, die Unternehmensstruktur wird aber sowas von vernachlässigt.  Die Bewertungen hier sprechen für sich. Aber juckt euch scheinbar nicht 😂  Euere callcenter machen amazon Konkurrenz. Und das muss man erstmal schaffen.  Kann nur jedem raten: lasst euch nicht einlullen, euch irgendwas andrehen, euch unter Druck setzen. Wenn eine Firma es gutheißt, seine Kunden unter Druck zu setzen, dann haben sie keinen Cent von euch verdient ","Wenn Mitarbeiter ins Telefon ""yalla""…",Valorada con 1 estrellas sobre 5
"Würde auch keinen Stern geben. Nachdem ich 2 Jahre lang kaum Internet hatte hab ich fristgerecht den Anbieter gewechselt. Komisch - da ging alles… mit dem Telekomeigenen Rücksendeetikett ging dann der Router zurück. 3 Jahre später wird mir dieser dann in Rechnung gestellt. Und als ich versuche das Thema zu klären geben die an KSP (hier Bewertung 1,1- mehr muss ich nicht sagen) ab und die machen direkt einen negativen Eintrag, obwohl ich nicht schuld bin. Nun ist natürlich keiner mehr erreichbar. ",Würde auch keinen Stern geben,Valorada con 1 estrellas sobre 5
Der Ton und die Unfreundlichkeit sowie die Überheblichkeit gepaart mit Inkompetenz der technischen Servicemitarbeiter am Telefon haben mich wirklich schockiert.,Der Ton und die Unfreundlichkeit sowie…,Valorada con 1 estrellas sobre 5
"Habe meine Internetgeschwindigkeit moniert, 2x Techniker vor Ort, jedes mal 1 Tag Urlaub, Ergebnis erfolglos, es wurde nicht schneller. 2. Techniker meinte, ich soll einfach mal abwarten. Am nächsten Tag dann E-Mail: Auftrag erfolgreich abgeschlossen, Internetgeschwindigkeit entspricht dem gebuchten Produkt. Ich habe Magenta L, lt. Speedtest bekomme ich nicht mal die Hälfte des gebuchten Volumens herein.  Auf Nachfrage bei anderen Anbietern: an meiner Adresse ist diese Geschwindigkeit leider nicht verfügbar. Hotlinekontakt: nur gut, wenn man anruft um ein neues Produkt zu bestellen. Bei Beschwerden: Mitarbeiter, die sehr schlecht Deutsch sprechen und meist auch noch unverschämt sind! Wenn es keinen Stern gäbe, hätte ich das vergeben.","Telekom hält nicht das, was sie versprechen!",Valorada con 1 estrellas sobre 5
Es wurde uns ein neuer Reciever AUFGEZWUNGEN!!! .Das Sch.....Teil funktioniert schon nach einer Woche nicht mehr!!!!Warum das ganze überhaupt????,Es wurde uns ein neuer Reciever…,Valorada con 1 estrellas sobre 5
"Das Online-Kontaktformular ist eine Zumutung. Es ist praktisch nicht möglich, eine Beschwerde darüber abzugeben, dass der bei Vertragsabschluss zugesicherte Cashback nicht dem Konto gutgeschrieben wurde. Was an sich schon überhaupt nicht in Ordnung ist.",Online-Kontaktformular ist eine Zumutung,Valorada con 1 estrellas sobre 5
"Wie konnte der Konzern nur so lange am Markt überleben, bekommen nicht einmal die einfachsten Dinge auf die Reihe, nur mit Mahnungen sind sie flott und wissen wie man sie zustellt. Zum 01.01.26 werden die Rechnungen nicht mehr per Post zugestellt, dumm nur, wenn der Kunde darüber nicht informiert wird. Dafür klapp es aber mit postalischen Zustellung der Mahnung, auch gleich in doppelter Ausfertigung. Auf Nachfrage, warum keine Rechnung zugestellt wurde, kam die Begründung, dass auf elektronische Zustellung, also per Mail, nur dumm wenn der Kunde, wie meine Mutter 92 Jahre alt ist, und kein Internet nutzt. Angeblich sollte der Kunde über Mail über die Umstellung informiert worden sein. Da dieses nicht möglich war, zumindest hier, soll die Info telefonisch erfolgt sein. Auch das war nicht der Fall, es würde einfach nur schlampig gearbeitet und völlig dumm von den Mitarbeitern am Telefon fadenscheinige Versuche einer erfolgten  Information zu Versuch zu begründen.Kürzum geschrieben, ein Konzern, der es einfach nicht kann. Kein Konzept und inkompetente Mitarbeiter.",Zu dumm Rechnungsstellung den Kunden zuzustellen ,Valorada con 1 estrellas sobre 5
"Wollte eine Gebrauchsanleitung für Trockner downloaden. Und Zack kommt beim download ""streaming dienst...Epcos...Buisness Flee...15€. Hab sofort abgebrochen. Zu spät. Die 15,00 € für Buisness Flee stehen auf meiner Telekom Rechnung. Telekomtelefonate und Chats bringen gar nichts. Im Gegenteil muß mir anhören wäre ja selber schuld. Den Drittanbieter Buisness Flee will ich nicht kontaktieren - sonst hat der noch mehr Daten von mir. Unglaublich das ein Unternehmen wie Telekom solchen Betrug unterstützt und solche unseriösen Drittanbietern über Telekomrechnungen Geld bekommen. Kundenservice katastrophal. ",Telekom und unseriöse Drittanbieter,Valorada con 1 estrellas sobre 5
"Die Telekom zeigt sich bei einem Festnetz-Internet Vertrag sehr verlässlich und kundenorientiert. Es wird ein umfangreiches Sortiment von Mobilfunk über Glasfaser und DSL bis hin zu Hybrid angeboten. Ein Vertrag kann ohne große Probleme online abgeschlossen werden. Die Einrichtung erfolgt zeitnah und unkompliziert zum angegeben Zeitpunkt. Der Versand der bestellten Artikel verläuft sehr schnell. Die Eigenprodukte wie Magenta TV One wirken ausgereift und funktionieren sehr gut. Bezüglich der Leistung lässt sich feststellen, dass diese in diesem sogar über der gebuchten Option liegt. Es gibt ein attraktives Programm ""Magenta Moments"", dass einem sinnvolle und hochwertige Prämien zur Verfügung stellt. In seltenen Fällen kann es aber auch zu Problemen mit der Telekom kommen. So hatte eine Mitarbeiterin bei einem Gespräch fehlendes technischen Wissen über das Produkt der eigenen Firma gezeigt und verschiedene Dinge durcheinander gebracht. Hier wurden die Bedenken aber von der Filiale ernst genommen und es wurde später versucht eine Lösung zu finden. Ferner liegen manchmal auch technische Probleme vor. In seltenen Fällen (nach einem Jahr einmal vorgekommen) kam es zu einem Problem mit der Internet-Verbindung. So konnte 2 Tage keine Verbindung hergestellt werden. Eine weitere Auffälligkeit sind technische Fehler, die bei einem Tarifwechsel entstehen können; Es wird angezeigt, dass dieser fehlgeschlagen sei und auch wenn nach Kontakt mit dem Kundenservice dieser doch manuell ausgeführt wurde, ändert sich die Information über den Wechsel in der Auftragsverfolgung nicht mehr.  Dies führt auch dazu, dass es keine Information über den Versand des gebuchten Produktes gab, sodass man mit einem Paket ""überrascht"" wird. Insgesamt wird aber deutlich, dass versucht wird die Fehler zu beheben und das Interesse besteht eine Lösung für den Kunden zu finden, sodass dieser Anbieter empfehlenswert ist.",Erfüllt die gestellten Erwartungen...,Valorada con 5 estrellas sobre 5
"Magenta TV Anmeldung an anderem Standort wird zum Staatsakt, verifizieren, authentifizieren, sensibilisieren und dann geht's los. Es nervt, jede Anmeldung nervt.",Magenta TV Anmeldung an anderem…,Valorada con 1 estrellas sobre 5
"Ich war viele Jahre Kunde bei der Telekom und wurde nach früheren Kündigungen auch mehrfach zurückgewonnen. Leider hat sich meine letzte Erfahrung deutlich negativer entwickelt. Nach meiner Kündigung erhielt ich über mehrere Tage hinweg mehrere Anrufe täglich, in denen nach dem Kündigungsgrund gefragt wurde. Obwohl ich mehrfach freundlich darauf hingewiesen habe, dass ich keinen telefonischen Kontakt wünsche, änderte sich daran nichts. Die Gespräche wirkten zudem oft hektisch, sodass ich mein Anliegen kaum vollständig erklären konnte. Besonders auffällig war für mich, dass sich die Qualität meines Anschlusses nach der Kündigung spürbar verschlechterte: langsamere Verbindungen, längere Ladezeiten und wiederkehrende Verbindungsabbrüche. Ob dies technisch zusammenhängt, kann ich natürlich nicht abschließend beurteilen, der zeitliche Zusammenhang war jedoch deutlich wahrnehmbar und sehr ärgerlich. Auch beim Thema Glasfaser empfand ich die Preisgestaltung als intransparent. Der zunächst angebotene Preis galt nur kurzzeitig, danach wurde es erheblich teurer. Im Vergleich zu anderen Anbietern erschien mir das Gesamtpaket daher nicht konkurrenzfähig. Der Hauptgrund meiner Kündigung war letztlich das Preis-Leistungs-Verhältnis: Für einen DSL-250-Tarif über 100 € monatlich zu zahlen, während vergleichbare Angebote deutlich günstiger erhältlich sind, konnte ich nicht mehr nachvollziehen. Auf meine Nachfrage nach Alternativen erhielt ich leider keine für mich passende Lösung. Positiv erwähnen möchte ich lediglich den Mobilfunk-Kundendienst, der meinen Vertrag kompetent angepasst hat. Insgesamt hinterlässt der Umgang mit Bestandskunden bei mir einen enttäuschenden Eindruck. Unter diesen Umständen werde ich die Telekom künftig nicht mehr nutzen.",Sehr enttäuschende Erfahrung nach Kündigung,Valorada con 1 estrellas sobre 5
"Seit Tagen erhalte ich immer wieder Anrufe zum Thema Glasfaser. Ich habe eine ETW in einer WEG. Ich teilte der Telekom mit, das ich dafür nicht zuständig sei. Trotzdem wurde ich nochmal öfter angerufen.  Dann erfuhr ich von meinem Mieter, die Telekom sei bei ihm gewesen und hätte gesagt, ich hätte den Vertrag unterschrieben für das Glasfasernetz. So eine Frecheit. Das ist ja kriminell. Und die Hausverwaltung weiss von alledem nichts. Wo sind wir denn hier 🤣😅😂 ",Telefonterror und Flunkereien,Valorada con 1 estrellas sobre 5
"Ich bewerte die Telekom als Geschäftskunde. Vor 7 Monaten bin ich mit meiner Arztpraxis umgezogen (Vorwahlbereich hat gewechselt) und habe nochmals 8 Monate vorher den Anschluss im neu gebauten Gebäude beantragt. Eigentlich kein Hexenwerk, sollte man glauben. Zunächst hat der Sub-Subunternehmer der Telekom der den Glasfaseranschluss von der Strasse ins Gebäude legen sollte pleite gemacht. Das hat niemand bemerkt und der Auftrag wurde nicht nur nicht bearbeitet, sondern in der EDV auf ""ausgeführt"" gestellt. Insgesamt habe ich mehr als 10 Stunden Telefonate dokumentiert, die teilweise so absurd waren, wie ich es nur aus Monty Pyton kenne. ""Nein das Glasfaserkabel liegt im Haus, bitte scannen Sie den Code auf der Dose"", ""hier ist keine Dose, ich kann das Glasfasekabel sehen, wie es aus dem Gehsteig ragt und aufgewickelt ist"", ""Ich sehe das in der EDV besser als Sie...."" Der 2. Stern ist für die Mitarbeiterinnen die sich zum teil verzweifelt um eine Lösung bemüht hatte. Viele haben mehr Interesse daran das Ticket vom Monitor zu bekommen, als eine Lösung zu finden. Im Moment habe ich 3 Verträge und 36 Telefonnummern. Die Portierung der 3 Nummern die ich wirklich brauche wurde abgelehnt. Bei der Telekom kennt man meinen Namen nicht.....",Ich bewerte die Telekom als…Geschäftskunde,Valorada con 2 estrellas sobre 5
"Es war ungeheuer anstrengend mit dem Menü klar zu kommen. Auch war die Hilfe am Telefon nicht zielführend. Lediglich die letzte Mitarbeiterin hatte die Idee, mein Guthaben direkt aufzuladen. Der danke ich sehr. Ich bekam ihre Hilfe leider erst nach mehr als einer halben Stunde. ",Es war ungeheuer anstrengend…,Valorada con 1 estrellas sobre 5
"Ich musste einen neuen Receiver von der Telekom im Austausch akzeptieren. Der hat keine Festplatte mehr. All Recording findet  nun in der Cloud statt. Was bedeutet das man Aufnahmen NICHT mehr vorspielen kann. Das ist echt das letzte. Die ""Sender""geben das nicht frei. Next Level für .............. Neue Technik nur für Einschränkung!!!!!",Ich musste einen neuen Receiver im…,Valorada con 1 estrellas sobre 5
Sehr freundliche nette kompetente Beratung.  Im Neuruppiner Reiz durch Frau Höhn Danke Schön Familie Wagner ,Sehr freundliche nette kompetente…,Valorada con 5 estrellas sobre 5
"Seit Tagen versuche ich meine Cloud zu kündigen. Es gibt keine Möglichkeit auf Vertragsdaten zuzugreifen, keine richtige Kündigungsseite, die E-Mails die man anschreiben kann, sind angeblich alle nicht für einen Zuständig und wenn Rückfragen der Telekom kommen, kann man nicht mal auf die E-Mails antworten ohne wieder nur ein ""Leider können wir Ihr Anliegen auf diesem Weg nicht beantworten."" zu erhalten. Nie wieder Telekom Cloud. Nie wieder!!!!!!!!!!!",Seit Tagen versuche ich meine Cloud zu…,Valorada con 1 estrellas sobre 5
"Unprofessioneller Kundenservice. Ich warte seit einem Monat auf meine Überzahlung. Ich habe den Kundenservice sechsmal kontaktiert. Mir wurde immer wieder versprochen, dass die Rückerstattung innerhalb von ein bis zwei Tagen erfolgt. Aber es passiert nichts. Ich habe keinerlei Informationen erhalten. Es ist, als ob mein Handy kaputt wäre.",Unprofessioneller Kundenservice,Valorada con 1 estrellas sobre 5
